{
  "schema": "mudmaker.ui-controls.v1",
  "workspace": "editor",
  "status": "DESIGN_NOT_IMPLEMENTED",
  "controls": [
    {
      "id": "editor.shell.01",
      "workspace": "editor",
      "surface": "editor.shell",
      "kind": "button",
      "label": "Save",
      "tooltip": "Commit local draft changes to project",
      "actionId": "ui.editor.save",
      "stateOwner": "EditorState",
      "permission": "localProjectUser",
      "visibleWhen": "surfaceActive",
      "enabledWhen": "authorizedAndReady",
      "stateVariants": [
        "ready",
        "disabled",
        "pending",
        "error"
      ],
      "keyboard": "focusAndActivate",
      "testId": "UI-editor-shell-01"
    },
    {
      "id": "editor.shell.02",
      "workspace": "editor",
      "surface": "editor.shell",
      "kind": "button",
      "label": "Save All",
      "tooltip": "Save all dirty local assets",
      "actionId": "ui.editor.saveAll",
      "stateOwner": "EditorState",
      "permission": "localProjectUser",
      "visibleWhen": "surfaceActive",
      "enabledWhen": "authorizedAndReady",
      "stateVariants": [
        "ready",
        "disabled",
        "pending",
        "error"
      ],
      "keyboard": "focusAndActivate",
      "testId": "UI-editor-shell-02"
    },
    {
      "id": "editor.shell.03",
      "workspace": "editor",
      "surface": "editor.shell",
      "kind": "button",
      "label": "Undo",
      "tooltip": "Undo most recent editor draft transaction",
      "actionId": "ui.editor.undo",
      "stateOwner": "EditorState",
      "permission": "localProjectUser",
      "visibleWhen": "surfaceActive",
      "enabledWhen": "authorizedAndReady",
      "stateVariants": [
        "ready",
        "disabled",
        "pending",
        "error"
      ],
      "keyboard": "focusAndActivate",
      "testId": "UI-editor-shell-03"
    },
    {
      "id": "editor.shell.04",
      "workspace": "editor",
      "surface": "editor.shell",
      "kind": "button",
      "label": "Redo",
      "tooltip": "Redo last undone editor draft transaction",
      "actionId": "ui.editor.redo",
      "stateOwner": "EditorState",
      "permission": "localProjectUser",
      "visibleWhen": "surfaceActive",
      "enabledWhen": "authorizedAndReady",
      "stateVariants": [
        "ready",
        "disabled",
        "pending",
        "error"
      ],
      "keyboard": "focusAndActivate",
      "testId": "UI-editor-shell-04"
    },
    {
      "id": "editor.shell.05",
      "workspace": "editor",
      "surface": "editor.shell",
      "kind": "button",
      "label": "Validate",
      "tooltip": "Run project schema and reference validation",
      "actionId": "ui.editor.validate",
      "stateOwner": "EditorState",
      "permission": "localProjectUser",
      "visibleWhen": "surfaceActive",
      "enabledWhen": "authorizedAndReady",
      "stateVariants": [
        "ready",
        "disabled",
        "pending",
        "error"
      ],
      "keyboard": "focusAndActivate",
      "testId": "UI-editor-shell-05"
    },
    {
      "id": "editor.shell.06",
      "workspace": "editor",
      "surface": "editor.shell",
      "kind": "button",
      "label": "Play Test",
      "tooltip": "Launch isolated test world and Player Client",
      "actionId": "ui.editor.playTest",
      "stateOwner": "EditorState",
      "permission": "localProjectUser",
      "visibleWhen": "surfaceActive",
      "enabledWhen": "authorizedAndReady",
      "stateVariants": [
        "ready",
        "disabled",
        "pending",
        "error"
      ],
      "keyboard": "focusAndActivate",
      "testId": "UI-editor-shell-06"
    },
    {
      "id": "editor.shell.07",
      "workspace": "editor",
      "surface": "editor.shell",
      "kind": "button",
      "label": "Publish",
      "tooltip": "Prepare immutable release and preflight",
      "actionId": "ui.editor.publish",
      "stateOwner": "EditorState",
      "permission": "localProjectUser",
      "visibleWhen": "surfaceActive",
      "enabledWhen": "authorizedAndReady",
      "stateVariants": [
        "ready",
        "disabled",
        "pending",
        "error"
      ],
      "keyboard": "focusAndActivate",
      "testId": "UI-editor-shell-07"
    },
    {
      "id": "editor.shell.08",
      "workspace": "editor",
      "surface": "editor.shell",
      "kind": "button",
      "label": "Global Search",
      "tooltip": "Find assets and commands in project",
      "actionId": "ui.editor.search",
      "stateOwner": "EditorState",
      "permission": "localProjectUser",
      "visibleWhen": "surfaceActive",
      "enabledWhen": "authorizedAndReady",
      "stateVariants": [
        "ready",
        "disabled",
        "pending",
        "error"
      ],
      "keyboard": "focusAndActivate",
      "testId": "UI-editor-shell-08"
    },
    {
      "id": "editor.shell.09",
      "workspace": "editor",
      "surface": "editor.shell",
      "kind": "dropdown",
      "label": "View",
      "tooltip": "Choose which panels are shown",
      "actionId": "ui.editor.panels",
      "stateOwner": "EditorState",
      "permission": "localProjectUser",
      "visibleWhen": "surfaceActive",
      "enabledWhen": "authorizedAndReady",
      "stateVariants": [
        "ready",
        "disabled",
        "pending",
        "error"
      ],
      "keyboard": "focusAndActivate",
      "testId": "UI-editor-shell-09"
    },
    {
      "id": "editor.shell.10",
      "workspace": "editor",
      "surface": "editor.shell",
      "kind": "button",
      "label": "Help",
      "tooltip": "Open contextual editor documentation",
      "actionId": "ui.editor.help",
      "stateOwner": "EditorState",
      "permission": "localProjectUser",
      "visibleWhen": "surfaceActive",
      "enabledWhen": "authorizedAndReady",
      "stateVariants": [
        "ready",
        "disabled",
        "pending",
        "error"
      ],
      "keyboard": "focusAndActivate",
      "testId": "UI-editor-shell-10"
    },
    {
      "id": "editor.shell.11",
      "workspace": "editor",
      "surface": "editor.shell",
      "kind": "text",
      "label": "Project Title",
      "tooltip": "Shows current project and schema version",
      "actionId": null,
      "stateOwner": "EditorState",
      "permission": "localProjectUser",
      "visibleWhen": "surfaceActive",
      "enabledWhen": "notApplicable",
      "stateVariants": [
        "visible",
        "empty",
        "loading",
        "error"
      ],
      "keyboard": "semanticRead",
      "testId": "UI-editor-shell-11"
    },
    {
      "id": "editor.shell.12",
      "workspace": "editor",
      "surface": "editor.shell",
      "kind": "status",
      "label": "Save Status",
      "tooltip": "Shows dirty, saving, saved or failed accurately",
      "actionId": null,
      "stateOwner": "EditorState",
      "permission": "localProjectUser",
      "visibleWhen": "surfaceActive",
      "enabledWhen": "notApplicable",
      "stateVariants": [
        "visible",
        "empty",
        "loading",
        "error"
      ],
      "keyboard": "semanticRead",
      "testId": "UI-editor-shell-12"
    },
    {
      "id": "editor.shell.13",
      "workspace": "editor",
      "surface": "editor.shell",
      "kind": "tab",
      "label": "Workspace Tabs",
      "tooltip": "Switch among open asset workspaces",
      "actionId": "ui.editor.tabSelect",
      "stateOwner": "EditorState",
      "permission": "localProjectUser",
      "visibleWhen": "surfaceActive",
      "enabledWhen": "authorizedAndReady",
      "stateVariants": [
        "ready",
        "disabled",
        "pending",
        "error"
      ],
      "keyboard": "focusAndActivate",
      "testId": "UI-editor-shell-13"
    },
    {
      "id": "editor.shell.14",
      "workspace": "editor",
      "surface": "editor.shell",
      "kind": "dropdown",
      "label": "Build",
      "tooltip": "Validate, test or publish the project",
      "actionId": "ui.editor.buildMenu",
      "stateOwner": "EditorState",
      "permission": "localProjectUser",
      "visibleWhen": "surfaceActive",
      "enabledWhen": "authorizedAndReady",
      "stateVariants": [
        "ready",
        "disabled",
        "pending",
        "error"
      ],
      "keyboard": "focusAndActivate",
      "testId": "UI-editor-shell-14"
    },
    {
      "id": "editor.shell.15",
      "workspace": "editor",
      "surface": "editor.shell",
      "kind": "button",
      "label": "Assets",
      "tooltip": "Show or hide the Asset Explorer",
      "actionId": "ui.editor.showAssets",
      "stateOwner": "EditorState",
      "permission": "localProjectUser",
      "visibleWhen": "surfaceActive",
      "enabledWhen": "authorizedAndReady",
      "stateVariants": [
        "ready",
        "disabled",
        "pending",
        "error"
      ],
      "keyboard": "focusAndActivate",
      "testId": "UI-editor-shell-15"
    },
    {
      "id": "editor.shell.16",
      "workspace": "editor",
      "surface": "editor.shell",
      "kind": "button",
      "label": "Inspector",
      "tooltip": "Show or hide the Inspector for the selection",
      "actionId": "ui.editor.showInspector",
      "stateOwner": "EditorState",
      "permission": "localProjectUser",
      "visibleWhen": "surfaceActive",
      "enabledWhen": "authorizedAndReady",
      "stateVariants": [
        "ready",
        "disabled",
        "pending",
        "error"
      ],
      "keyboard": "focusAndActivate",
      "testId": "UI-editor-shell-16"
    },
    {
      "id": "editor.assets.01",
      "workspace": "editor",
      "surface": "editor.assets",
      "kind": "tree",
      "label": "Asset Explorer",
      "tooltip": "Browse folders and project asset tree",
      "actionId": "ui.editor.assetSelect",
      "stateOwner": "EditorState",
      "permission": "localProjectUser",
      "visibleWhen": "surfaceActive",
      "enabledWhen": "authorizedAndReady",
      "stateVariants": [
        "ready",